571;zoroark;ゾロアーク;16;811;dark;;illusion;;;gray;;upright;Illusion Fox;Bonds between these Pokémon are very strong. It protects the safety of its pack by tricking its opponents.;60;105;60;120;60;105
572;minccino;チラーミィ;4;58;normal;;cute-charm;technician;skill-link;gray;;quadruped;Chinchilla;These Pokémon prefer a tidy habitat. They are always sweeping and dusting, using their tails as brooms.;55;50;40;40;40;75
573;cinccino;チラチーノ;5;75;normal;;cute-charm;technician;skill-link;gray;;quadruped;Scarf;Cinccino’s body is coated in a special oil that helps it deflect attacks, such as punches.;75;95;60;65;60;115
574;gothita;ゴチム;4;58;psychic;;frisk;competitive;shadow-tag;purple;;humanoid;Fixation;They intently observe both Trainers and Pokémon. Apparently, they are looking at something that only Gothita can see.;45;30;50;55;65;45
575;gothorita;ゴチミル;7;180;psychic;;frisk;competitive;shadow-tag;purple;;humanoid;Manipulate;According to many old tales, it creates friends for itself by controlling sleeping children on starry nights.;60;45;70;75;85;55
576;gothitelle;ゴチルゼル;15;440;psychic;;frisk;competitive;shadow-tag;purple;;humanoid;Astral Body;They can predict the future from the placement and movement of the stars. They can see Trainers’ life spans.;70;55;95;95;110;65
577;solosis;ユニラン;3;10;psychic;;overcoat;magic-guard;regenerator;green;;ball;Cell;They drive away attackers by unleashing psychic power. They can use telepathy to talk with others.;45;30;40;105;50;20
578;duosion;ダブラン;6;80;psychic;;overcoat;magic-guard;regenerator;green;;ball;Mitosis;When their two divided brains think the same thoughts, their psychic power is maximized.;65;40;50;125;60;30
579;reuniclus;ランクルス;10;201;psychic;;overcoat;magic-guard;regenerator;green;;arms;Multiplying;When Reuniclus shake hands, a network forms between their brains, increasing their psychic power.;110;65;75;125;85;30
580;ducklett;コアルヒー;5;55;water;flying;keen-eye;big-pecks;hydration;blue;;wings;Water Bird;They are better at swimming than flying, and they happily eat their favorite food, peat moss, as they dive underwater.;62;44;50;44;50;55
581;swanna;スワンナ;13;242;water;flying;keen-eye;big-pecks;hydration;white;;wings;White Bird;Swanna start to dance at dusk. The one dancing in the middle is the leader of the flock.;75;87;63;87;63;98
582;vanillite;バニプッチ;4;57;ice;;ice-body;;weak-armor;white;;blob;Fresh Snow;This Pokémon formed from icicles bathed in energy from the morning sun. It sleeps buried in snow.;36;50;50;65;60;44
583;vanillish;バニリッチ;11;410;ice;;ice-body;;weak-armor;white;;blob;Icy Snow;Snowy mountains are this Pokémon’s habitat. During an ancient ice age, they moved to southern areas.;51;65;65;80;75;59
584;vanilluxe;バイバニラ;13;575;ice;;ice-body;;weak-armor;white;;heads;Snowstorm;Swallowing large amounts of water, they make snow clouds inside their bodies and, when angry, cause violent blizzards.;71;95;85;110;95;79
585;deerling;シキジカ;6;195;normal;grass;chlorophyll;sap-sipper;serene-grace;yellow;;quadruped;Season;The turning of the seasons changes the color and scent of this Pokémon’s fur. People use it to mark the seasons.;60;60;50;40;50;75
586;sawsbuck;メブキジカ;19;925;normal;grass;chlorophyll;sap-sipper;serene-grace;brown;;quadruped;Season;They migrate according to the seasons, so some people call Sawsbuck the harbingers of spring.;80;100;70;60;70;95
587;emolga;エモンガ;4;50;electric;flying;static;;motor-drive;white;;quadruped;Sky Squirrel;The energy made in its cheeks’ electric pouches is stored inside its membrane and released while it is gliding.;55;75;60;75;60;103
588;karrablast;カブルモ;5;59;bug;;swarm;shed-skin;no-guard;blue;;humanoid;Clamping;For some reason they evolve when they receive electrical energy while they are attacking Shelmet.;50;75;45;40;45;60
589;escavalier;シュバルゴ;10;330;bug;steel;swarm;shell-armor;overcoat;gray;;arms;Cavalry;These Pokémon evolve by wearing the shell covering of a Shelmet. The steel armor protects their whole body.;70;135;105;60;105;20
590;foongus;タマゲタケ;2;10;grass;poison;effect-spore;;regenerator;white;;arms;Mushroom;It lures Pokémon with its pattern that looks just like a Poké Ball, then releases poison spores.;69;55;45;55;55;15
591;amoonguss;モロバレル;6;105;grass;poison;effect-spore;;regenerator;white;;arms;Mushroom;It lures prey close by dancing and waving its arm caps, which resemble Poké Balls, in a swaying motion.;114;85;70;85;80;30
592;frillish;プルリル;12;330;water;ghost;water-absorb;cursed-body;damp;white;;tentacles;Floating;If its veil-like arms stun and wrap a foe, that foe will be dragged miles below the surface, never to return.;55;40;50;65;85;40
593;jellicent;ブルンゲル;22;1350;water;ghost;water-absorb;cursed-body;damp;white;;tentacles;Floating;The fate of the ships and crew that wander into Jellicent’s habitat: all sunken, all lost, all vanished.;100;60;70;85;105;60
594;alomomola;ママンボウ;12;316;water;;healer;hydration;regenerator;pink;;fish;Caring;It gently holds injured and weak Pokémon in its fins. Its special membrane heals their wounds.;165;75;80;40;45;65
595;joltik;バチュル;1;6;bug;electric;compound-eyes;unnerve;swarm;yellow;;armor;Attaching;They attach themselves to large-bodied Pokémon and absorb static electricity, which they store in an electric pouch.;50;47;50;57;50;65
596;galvantula;デンチュラ;8;143;bug;electric;compound-eyes;unnerve;swarm;yellow;;armor;EleSpider;When attacked, they create an electric barrier by spitting out many electrically charged threads.;70;77;60;97;60;108
597;ferroseed;テッシード;6;188;grass;steel;iron-barbs;;;gray;;ball;Thorn Seed;It absorbs the iron it finds in the rock while clinging to the ceiling. It shoots spikes when in danger.;44;50;91;24;86;10
598;ferrothorn;ナットレイ;10;1100;grass;steel;iron-barbs;;anticipation;gray;;tentacles;Thorn Pod;They attach themselves to cave ceilings, firing steel spikes at targets passing beneath them.;74;94;131;54;116;20
599;klink;ギアル;3;210;steel;;plus;minus;clear-body;gray;;heads;Gear;The two minigears that mesh together are predetermined. Each will rebound from other minigears without meshing.;40;55;70;45;60;30
600;klang;ギギアル;6;510;steel;;plus;minus;clear-body;gray;;heads;Gear;A minigear and big gear comprise its body. If the minigear it launches at a foe doesn’t return, it will die.;60;80;95;70;85;50
601;klinklang;ギギギアル;6;810;steel;;plus;minus;clear-body;gray;;heads;Gear;Its red core functions as an energy tank. It fires the charged energy through its spikes into an area.;60;100;115;70;85;90
602;tynamo;シビシラス;2;3;electric;;levitate;;;white;;fish;EleFish;One alone can emit only a trickle of electricity, so a group of them gathers to unleash a powerful electric shock.;35;55;40;45;40;60
603;eelektrik;シビビール;12;220;electric;;levitate;;;blue;;fish;EleFish;These Pokémon have a big appetite. When they spot their prey, they attack it and paralyze it with electricity.;65;85;70;75;70;40
604;eelektross;シビルドン;21;805;electric;;levitate;;;blue;;fish;EleFish;They crawl out of the ocean using their arms. They will attack prey on shore and immediately drag it into the ocean.;85;115;80;105;80;50
605;elgyem;リグレー;5;90;psychic;;telepathy;synchronize;analytic;blue;;upright;Cerebral;Rumors of its origin are linked to a UFO crash site in the desert 50 years ago.;55;55;55;85;55;30
606;beheeyem;オーベム;10;345;psychic;;telepathy;synchronize;analytic;brown;;humanoid;Cerebral;It uses psychic power to control an opponent’s brain and tamper with its memories.;75;75;75;125;95;40
607;litwick;ヒトモシ;3;31;ghost;fire;flash-fire;flame-body;infiltrator;white;;blob;Candle;Litwick shines a light that absorbs the life energy of people and Pokémon, which becomes the fuel that it burns.;50;30;55;65;55;20
608;lampent;ランプラー;6;130;ghost;fire;flash-fire;flame-body;infiltrator;black;;arms;Lamp;It arrives near the moment of death and steals spirit from the body.;60;40;60;95;60;55
609;chandelure;シャンデラ;10;343;ghost;fire;flash-fire;flame-body;infiltrator;black;;arms;Luring;The spirits burned up in its ominous flame lose their way and wander this world forever.;60;55;90;145;90;80
610;axew;キバゴ;6;180;dragon;;rivalry;mold-breaker;unnerve;green;;upright;Tusk;They mark their territory by leaving gashes in trees with their tusks. If a tusk breaks, a new one grows in quickly.;46;87;60;30;40;57
611;fraxure;オノンド;10;360;dragon;;rivalry;mold-breaker;unnerve;green;;upright;Axe Jaw;A broken tusk will not grow back, so it diligently sharpens its tusks on river rocks after the end of a battle.;66;117;70;40;50;67
612;haxorus;オノノクス;18;1055;dragon;;rivalry;mold-breaker;unnerve;yellow;;upright;Axe Jaw;Their sturdy tusks will stay sharp even if used to cut steel beams. These Pokémon are covered in hard armor.;76;147;90;60;70;97
613;cubchoo;クマシュン;5;85;ice;;snow-cloak;;rattled;white;;upright;Chill;Their snot is a barometer of health. When healthy, their snot is sticky and the power of their ice moves increases.;55;70;40;60;40;40
614;beartic;ツンベアー;26;2600;ice;;snow-cloak;;swift-swim;white;;quadruped;Freezing;It freezes its breath to create fangs and claws of ice to fight with. Cold northern areas are its habitat.;95;110;80;70;80;50
615;cryogonal;フリージオ;11;1480;ice;;levitate;;;blue;;ball;Crystallizing;They are composed of ice crystals. They capture prey with chains of ice, freezing the prey at -148 degrees Fahrenheit.;70;50;30;95;135;105
616;shelmet;チョボマキ;4;77;bug;;hydration;shell-armor;overcoat;red;;ball;Snail;It evolves when bathed in an electric-like energy along with Karrablast. The reason is still unknown.;50;40;85;40;65;25
617;accelgor;アギルダー;8;253;bug;;hydration;sticky-hold;unburden;red;;arms;Shell Out;When its body dries out, it weakens. So, to prevent dehydration, it wraps itself in many layers of thin membrane.;80;70;40;100;60;145
618;stunfisk;マッギョ;7;110;ground;electric;static;limber;sand-veil;brown;;fish;Trap;It conceals itself in the mud of the seashore. Then it waits. When prey touch it, it delivers a jolt of electricity.;109;66;84;81;99;32
619;mienfoo;コジョフー;9;200;fighting;;inner-focus;regenerator;reckless;yellow;;upright;Martial Arts;In fights, they dominate with onslaughts of flowing, continuous attacks. With their sharp claws, they cut enemies.;45;85;50;55;50;65
620;mienshao;コジョンド;14;355;fighting;;inner-focus;regenerator;reckless;purple;;upright;Martial Arts;Using the long fur on its arms like whips, it launches into combo attacks that, once started, no one can stop.;65;125;60;95;60;105
621;druddigon;クリムガン;16;1390;dragon;;rough-skin;sheer-force;mold-breaker;red;;upright;Cave;It warms its body by absorbing sunlight with its wings. When its body temperature falls, it can no longer move.;77;120;90;60;90;48
622;golett;ゴビット;10;920;ground;ghost;iron-fist;klutz;no-guard;green;;humanoid;Automaton;Ancient science fashioned this Pokémon from clay. It’s been active for thousands of years.;59;74;50;35;50;35
623;golurk;ゴルーグ;28;3300;ground;ghost;iron-fist;klutz;no-guard;green;;humanoid;Automaton;It flies across the sky at Mach speeds. Removing the seal on its chest makes its internal energy go out of control.;89;124;80;55;80;55
624;pawniard;コマタナ;5;102;dark;steel;defiant;inner-focus;pressure;red;;humanoid;Sharp Blade;Ignoring their injuries, groups attack by sinking the blades that cover their bodies into their prey.;45;85;70;40;40;60
625;bisharp;キリキザン;16;700;dark;steel;defiant;inner-focus;pressure;red;;humanoid;Sword Blade;Bisharp pursues prey in the company of a large group of Pawniard. Then Bisharp finishes off the prey.;65;125;100;60;70;70
626;bouffalant;バッフロン;16;946;normal;;reckless;sap-sipper;soundproof;brown;;quadruped;Bash Buffalo;Their fluffy fur absorbs damage, even if they strike foes with a fierce headbutt.;95;110;95;40;95;55
627;rufflet;ワシボン;5;105;normal;flying;keen-eye;sheer-force;hustle;white;;wings;Eaglet;They will challenge anything, even strong opponents, without fear. Their frequent fights help them become stronger.;70;83;50;37;50;60
628;braviary;ウォーグル;15;410;normal;flying;keen-eye;sheer-force;defiant;red;;wings;Valiant;They fight for their friends without any thought about danger to themselves. One can carry a car while flying.;100;123;75;57;75;80
629;vullaby;バルチャイ;5;90;dark;flying;big-pecks;overcoat;weak-armor;brown;;wings;Diapered;Their wings are too tiny to allow them to fly. They guard their posteriors with bones that were gathered by Mandibuzz.;70;55;75;45;65;60
630;mandibuzz;バルジーナ;12;395;dark;flying;big-pecks;overcoat;weak-armor;brown;;wings;Bone Vulture;Watching from the sky, they swoop to strike weakened Pokémon on the ground. They decorate themselves with bones.;110;65;105;55;95;80
631;heatmor;クイタラン;14;580;fire;;gluttony;flash-fire;white-smoke;red;;upright;Anteater;It draws in air through its tail, transforms it into fire, and uses it like a tongue. It melts Durant and eats them.;85;97;66;105;66;65
632;durant;アイアント;3;330;bug;steel;swarm;hustle;truant;gray;;armor;Iron Ant;They attack in groups, covering themselves in steel armor to protect themselves from Heatmor.;58;109;112;48;48;109
633;deino;モノズ;8;173;dark;dragon;hustle;;;blue;;quadruped;Irate;Lacking sight, it’s unaware of its surroundings, so it bumps into things and eats anything that moves.;52;65;50;45;50;38
634;zweilous;ジヘッド;14;500;dark;dragon;hustle;;;blue;;quadruped;Hostile;After it has eaten up all the food in its territory, it moves to another area. Its two heads do not get along.;72;85;70;65;70;58
635;hydreigon;サザンドラ;18;1600;dark;dragon;levitate;;;blue;;upright;Brutal;It responds to movement by attacking. This scary, three-headed Pokémon devours everything in its path!;92;105;90;125;90;98
636;larvesta;メラルバ;11;288;bug;fire;flame-body;;swarm;white;;armor;Torch;The base of volcanoes is where they make their homes. They shoot fire from their five horns to repel attacking enemies.;55;85;55;50;55;60
637;volcarona;ウルガモス;16;460;bug;fire;flame-body;;swarm;white;;bug-wings;Sun;When volcanic ash darkened the atmosphere, it is said that Volcarona’s fire provided a replacement for the sun.;85;60;65;135;105;100
638;cobalion;コバルオン;21;2500;steel;fighting;justified;;;blue;;quadruped;Iron Will;It has a body and heart of steel. It worked with its allies to punish people when they hurt Pokémon.;91;90;129;90;72;108
639;terrakion;テラキオン;19;2600;rock;fighting;justified;;;gray;;quadruped;Cavern;Spoken of in legend, this Pokémon used its phenomenal power to destroy a castle in its effort to protect Pokémon.;91;129;90;72;90;108
640;virizion;ビリジオン;20;2000;grass;fighting;justified;;;green;;quadruped;Grassland;Legends say this Pokémon confounded opponents with its swift movements.;91;90;72;90;129;108
641;tornadus-incarnate;トルネロス;15;630;flying;;prankster;;defiant;green;;arms;Cyclone;Tornadus expels massive energy from its tail, causing severe storms. Its power is great enough to blow houses away.;79;115;70;125;80;111
642;thundurus-incarnate;ボルトロス;15;610;electric;flying;prankster;;defiant;blue;;arms;Bolt Strike;As it flies around, it shoots lightning all over the place and causes forest fires. It is therefore disliked.;79;115;70;125;80;111
643;reshiram;レシラム;32;3300;dragon;fire;turboblaze;;;white;;wings;Vast White;When Reshiram’s tail flares, the heat energy moves the atmosphere and changes the world’s weather.;100;120;100;150;120;90
644;zekrom;ゼクロム;29;3450;dragon;electric;teravolt;;;black;;upright;Deep Black;Concealing itself in lightning clouds, it flies throughout the Unova region. It creates electricity in its tail.;100;150;120;120;100;90
645;landorus-incarnate;ランドロス;15;680;ground;flying;sand-force;;sheer-force;brown;;arms;Abundance;From the forces of lightning and wind, it creates energy to give nutrients to the soil and make the land abundant.;89;125;90;115;80;101
646;kyurem;キュレム;30;3250;dragon;ice;pressure;;;gray;;upright;Boundary;It generates a powerful, freezing energy inside itself, but its body became frozen when the energy leaked out.;125;130;90;130;90;95
647;keldeo-ordinary;ケルディオ;14;485;water;fighting;justified;;;yellow;;quadruped;Colt;When it is resolute, its body fills with power and it becomes swifter. Its jumps are then too fast to follow.;91;72;90;129;90;108
648;meloetta-aria;メロエッタ;6;65;normal;psychic;serene-grace;;;white;;humanoid;Melody;Its melodies are sung with a special vocalization method that can control the feelings of those who hear it.;100;77;77;128;128;90
649;genesect;ゲノセクト;15;825;bug;steel;download;;;purple;;humanoid;Paleozoic;This Pokémon existed 300 million years ago. Team Plasma altered it and attached a cannon to its back.;71;120;95;120;95;99
650;chespin;ハリマロン;4;90;grass;;overgrow;;bulletproof;green;;upright;Spiny Nut;Such a thick shell of wood covers its head and back that even a direct hit from a truck wouldn’t faze it.;56;61;65;48;45;38
651;quilladin;ハリボーグ;7;290;grass;;overgrow;;bulletproof;green;;upright;Spiny Armor;They strengthen their lower bodies by running into one another. They are very kind and won’t start fights.;61;78;95;56;58;57
652;chesnaught;ブリガロン;16;900;grass;fighting;overgrow;;bulletproof;green;;upright;Spiny Armor;When it takes a defensive posture with its fists guarding its face, it could withstand a bomb blast.;88;107;122;74;75;64
653;fennekin;フォッコ;4;94;fire;;blaze;;magician;red;;quadruped;Fox;As it walks, it munches on a twig in place of a snack. It intimidates opponents by puffing hot air out of its ears.;40;45;40;62;60;60
654;braixen;テールナー;10;145;fire;;blaze;;magician;red;;upright;Fox;When the twig is plucked from its tail, friction sets the twig alight. The flame is used to send signals to its allies.;59;59;58;90;70;73
655;delphox;マフォクシー;15;390;fire;psychic;blaze;;magician;red;;upright;Fox;Using psychic power, it generates a fiery vortex of 5,400 degrees Fahrenheit, incinerating foes swept into this whirl of flame.;75;69;72;114;100;104
656;froakie;ケロマツ;3;70;water;;torrent;;protean;blue;;quadruped;Bubble Frog;It protects its skin by covering its body in delicate bubbles. Beneath its happy-go-lucky air, it keeps a watchful eye on its surroundings.;41;56;40;62;44;71
657;frogadier;ゲコガシラ;6;109;water;;torrent;;protean;blue;;humanoid;Bubble Frog;Its swiftness is unparalleled. It can scale a tower of more than 2,000 feet in a minute’s time.;54;63;52;83;56;97
658;greninja;ゲッコウガ;15;400;water;dark;torrent;;protean;blue;;humanoid;Ninja;It appears and vanishes with a ninja’s grace. It toys with its enemies using swift movements, while slicing them with throwing stars of sharpest water.;72;95;67;103;71;122
659;bunnelby;ホルビー;4;50;normal;;pickup;cheek-pouch;huge-power;brown;;upright;Digging;It has ears like shovels. Digging holes strengthens its ears so much that they can sever thick roots effortlessly.;38;36;38;32;36;57
660;diggersby;ホルード;10;424;normal;ground;pickup;cheek-pouch;huge-power;brown;;upright;Digging;As powerful as an excavator, its ears can reduce dense bedrock to rubble. When it’s finished digging, it lounges lazily.;85;56;77;50;77;78
661;fletchling;ヤヤコマ;3;17;normal;flying;big-pecks;;gale-wings;red;;wings;Tiny Robin;Despite the beauty of its lilting voice, it’s merciless to intruders that enter its territory.;45;50;43;40;38;62
662;fletchinder;ヒノヤコマ;7;160;fire;flying;flame-body;;gale-wings;red;;wings;Ember;The hotter the flame sac on its belly, the faster it can fly, but it takes some time to get the fire going.;62;73;55;56;52;84
663;talonflame;ファイアロー;12;245;fire;flying;flame-body;;gale-wings;red;;wings;Scorching;When attacking prey, it can reach speeds of up to 310 mph. It finishes its prey off with a colossal kick.;78;81;71;74;69;126
664;scatterbug;コフキムシ;3;25;bug;;shield-dust;compound-eyes;friend-guard;black;;armor;Scatterdust;The powder that covers its body regulates its temperature, so it can live in any region or climate.;38;35;40;27;25;35
665;spewpa;コフーライ;3;84;bug;;shed-skin;;friend-guard;black;;blob;Scatterdust;The beaks of bird Pokémon can’t begin to scratch its stalwart body. To defend itself, it spews powder.;45;22;60;27;30;29
666;vivillon;ビビヨン;12;170;bug;flying;shield-dust;compound-eyes;friend-guard;black;;bug-wings;Scale;The patterns on this Pokémon’s wings depend on the climate and topography of its habitat. It scatters colorful scales.;80;52;50;90;50;89
667;litleo;シシコ;6;135;fire;normal;rivalry;unnerve;moxie;brown;;quadruped;Lion Cub;They set off on their own from their pride and live by themselves to become stronger. These hot-blooded Pokémon are quick to fight.;62;50;58;73;54;72
668;pyroar;カエンジシ;15;815;fire;normal;rivalry;unnerve;moxie;brown;;quadruped;Royal;With fiery breath of more than 10,000 degrees Fahrenheit, they viciously threaten any challenger. The females protect the pride’s cubs.;86;68;72;109;66;106
669;flabebe;フラベベ;1;1;fairy;;flower-veil;;symbiosis;white;;arms;Single Bloom;When it finds a flower it likes, it dwells on that flower its whole life long. It floats in the wind’s embrace with an untroubled heart.;44;38;39;61;79;42
670;floette;フラエッテ;2;9;fairy;;flower-veil;;symbiosis;white;;arms;Single Bloom;When the flowers of a well-tended flower bed bloom, it appears and celebrates with an elegant dance.;54;45;47;75;98;52
671;florges;フラージェス;11;100;fairy;;flower-veil;;symbiosis;white;;arms;Garden;In times long past, governors of castles would invite Florges to create flower gardens to embellish the castle domains.;78;65;68;112;154;75
672;skiddo;メェークル;9;310;grass;;sap-sipper;;grass-pelt;brown;;quadruped;Mount;If it has sunshine and water, it doesn’t need to eat, because it can generate energy from the leaves on its back.;66;65;48;62;57;52
673;gogoat;ゴーゴート;17;910;grass;;sap-sipper;;grass-pelt;brown;;quadruped;Mount;They inhabit mountainous regions. The leader of the herd is decided by a battle of clashing horns.;123;100;62;97;81;68
674;pancham;ヤンチャム;6;80;fighting;;iron-fist;mold-breaker;scrappy;white;;upright;Playful;It does its level best to glare and pull a scary face, but it can’t help grinning if anyone pats its head.;67;82;62;46;48;43
675;pangoro;ゴロンダ;21;1360;fighting;dark;iron-fist;mold-breaker;scrappy;white;;humanoid;Daunting;It charges ahead and bashes its opponents like a berserker, uncaring about any hits it might take. Its arms are mighty enough to snap a telephone pole.;95;124;78;69;71;58
676;furfrou;トリミアン;12;280;normal;;fur-coat;;;white;;quadruped;Poodle;Historically, in the Kalos region, these Pokémon were the designated guardians of the king.;75;80;60;65;90;102
677;espurr;ニャスパー;3;35;psychic;;keen-eye;infiltrator;own-tempo;gray;;upright;Restraint;It has enough psychic energy to blast everything within 300 feet of itself, but it has no control over its power.;62;48;54;63;60;68
678;meowstic-male;ニャオニクス;6;85;psychic;;keen-eye;infiltrator;prankster;white;;upright;Constraint;The eyeball patterns on the interior of its ears emit psychic energy. It keeps the patterns tightly covered because that power is too immense.;74;48;76;83;81;104
679;honedge;ヒトツキ;8;20;steel;ghost;no-guard;;;brown;;blob;Sword;If anyone dares to grab its hilt, it wraps a blue cloth around that person’s arm and drains that person’s life energy completely.;45;80;100;35;37;28
680;doublade;ニダンギル;8;45;steel;ghost;no-guard;;;brown;;heads;Sword;The complex attack patterns of its two swords are unstoppable, even for an opponent greatly accomplished at swordplay.;59;110;150;45;49;35
681;aegislash-shield;ギルガルド;17;530;steel;ghost;stance-change;;;brown;;blob;Royal Sword;Apparently, it can detect the innate qualities of leadership. According to legend, whoever it recognizes is destined to become king.;60;50;150;50;150;60
682;spritzee;シュシュプ;2;5;fairy;;healer;;aroma-veil;pink;;arms;Perfume;In the past, rather than using perfume, royal ladies carried a Spritzee that would waft a fragrance they liked.;78;52;60;63;65;23
683;aromatisse;フレフワン;8;155;fairy;;healer;;aroma-veil;pink;;humanoid;Fragrance;Its scent is so overpowering that, unless a Trainer happens to really enjoy the smell, he or she will have a hard time walking alongside it.;101;72;72;99;89;29
684;swirlix;ペロッパフ;4;35;fairy;;sweet-veil;;unburden;white;;legs;Cotton Candy;Because it eats nothing but sweets, its fur is as sticky sweet as cotton candy.;62;48;66;59;57;49
685;slurpuff;ペロリーム;8;50;fairy;;sweet-veil;;unburden;white;;humanoid;Meringue;Its sense of smell is 100 million times better than a human’s, so even the faintest scent tells it about everything in the area. It’s like it can see with its nose!;82;80;86;85;75;72
686;inkay;マーイーカ;4;35;dark;psychic;contrary;suction-cups;infiltrator;blue;;tentacles;Revolving;It flashes the light-emitting spots on its body, which drains its opponent’s will to fight. It takes the opportunity to scuttle away and hide.;53;54;53;37;46;45
687;malamar;カラマネロ;15;470;dark;psychic;contrary;suction-cups;infiltrator;blue;;blob;Overturning;It lures its prey close with hypnotic motions, then wraps its tentacles around it before finishing it off with digestive fluids.;86;92;88;68;75;73
